"We could all take less showers and waste less of our water ", "People can use black out curtains in their homes to better insulate the windows and save energy.", 2.0
"Learn to reuse our resources instead of throwing them away ", "We should use less plastic because they just end op in the ocean and since they don't degrade for a very long time they can harm to the wild life and ocean ecosystem.", 3.25
"change every bulb in your home to LED", "Unplug appliances that are rarely used. ", 1.4
" Use reusable bags when you go shopping instead of paper or plastic", " Plant grass and other plants in our yards that do not require much water to reduce water usage.", 1.8571428571428572
"They can recycle their waste as much as they can.", "Learn to reuse our resources instead of throwing them away ", 3.8
" Donate money to charities that protect the environment", " Buy paper products are other products that are made from recycled materials", 1.1666666666666667
"Use the microwave when possible instead of the oven.", "Buy from local farmers and farmers markets. This greatly reduces the mass transportation of products to large chain grocery stores, and also is environmentally friendly because they've taken the steps to make their own garden, as I explained in a previous answer. ", 0.6666666666666666
"People can recycle as much as they can to preserve the environment.", "Making products that utilize water to be efficient and recalling all products that are wasteful. Or making those products that are inefficient illegal state to state. ", 2.1666666666666665
"use solar or wind energy only to generate elctricity", "We can drive cars that are more fuel-efficient to cut waste and carbon emissions.", 2.6666666666666665
" learn how to 3d print food", "To help preserve the environment, people can help keep their communities clean. Not littering and picking up litter when possible can be beneficial. ", 0.5
"Develop vehicles that have very long range on a single battery charge.", " People should make a conscious effort to plant trees whenever they can.", 1.2
"Instead of turning on the heater/space heater, put on more layers or thicker layers of clothing if possible.", "Let grass grow longer before cutting it, which serves a dual purpose, both using less energy to cut, and grass that is longer is slightly more of a carbon sink.", 1.8
"no use of nuclear or coal energy", "Purchase and use reusable water bottles, chopsticks and flatware.", 1.0
"People can install solar panels in their home to use less energy.", "People can car-pool more to help stop pollution from all the extra vehicles. ", 2.2857142857142856
" learn how to 3d print food", "Using energy efficient CFL light bulbs instead of incandescent bulbs can help preserve the environment.", 0.7142857142857143
"Learn to live in smaller more cost efficient housing.", "People can switch off devices that they aren't using. We spend too much time on our computers now days and sometimes it's good to just turn them off so that we can enjoy life more stress free. This will save power and therefor the environment. ", 1.4
" Plant trees or other plants around your community", "We can all work together to use clean and safe energy ", 2.1666666666666665
" pass more legislation for companies", "We could all work together and get on the same page and do something to prevent global warming from worsening ", 1.1666666666666667
"Take no baths and fewer showers.", " Always recycle bottles and cans and throw trash in the garbage instead of on the ground", 1.25
"We could bring our own reusable bags to the shops to cut down on plastic bag and paper bag waste.", "People can weatherized their homes before winter to save on using heating, which will reduce the usage of fossil fuels like coal and petroleum oil.", 2.4285714285714284
" Don't pour soap or chemicals down the storm drain", "We can find newer forms of transportation that do not pollute the earth as much.", 1.0
"Purchase and use reusable water bottles, chopsticks and flatware.", " Plastic bags should be abolished in all countries and alternatives to plastic bags be provided. Plastic bags are some of the biggest polluters and abolishing them will go a long way. ", 1.4285714285714286
"change every bulb in your home to LED", "People can try to drive less and walk to more of their destinations.", 1.0
"Turing off lights when not in use can help preserve the environment.", " Plant grass and other plants in our yards that do not require much water to reduce water usage.", 2.142857142857143
"Reduce the amount that you drive each month", " Buy produce locally or at a local farmer's market", 0.4
"change every bulb in your home to LED", "People can cut down on their red meat consumption.", 1.3333333333333333
"make factories more environmentally friendly", "We can use energy saving light bulbs to cut down on waste and emissions.", 1.0
"Use non-toxic natural cleaners when possible. ", "Develop new technologies that create energy in a space-based environment, like new solar technologies and storage technologies.", 1.2
"Compost organic waste whenever possible.", "You can use cloth reusable bags at the grocery store instead of plastic bags, which are terrible for the environment. Cloth bags are easier to carry, and can be used for years. ", 1.2857142857142858
" urinate in the shower", "Remove dead trees and dry grass from areas when possible.", 0.0
"Stop procreating at such a fast clip.", "Help countries like Brazil with discounts on food so that they don't deforest the rain forest.", 0.6666666666666666
"People can use LED light bulbs.", "Recycle more, the less trash thrown away the less new stuff that needs to be created to replace it.", 1.3333333333333333
" Turn off your computer when not in use", " Buy paper products are other products that are made from recycled materials", 0.5
"Adopt children instead of having your own. Less people brought onto this planet mean less stress for the planet.", "Buy from local farmers and farmers markets. This greatly reduces the mass transportation of products to large chain grocery stores, and also is environmentally friendly because they've taken the steps to make their own garden, as I explained in a previous answer. ", 0.8
" pass more legislation for companies", " Carpool with people that work in the same areas.", 0.0
" People should carpool or use public transport as much as possible to help reduce carbon footprint. ", " Give bigger tax benefits to companies that use more wind and solar power generation and give them incentives to make the power more affordable to the consumer for more widespread usage.", 1.2
"Less use of fossil fuels", " Walk or use a bicycle to get places around town", 1.4285714285714286
"use electric vehicles more", " Buy energy efficient light bulbs", 1.2
"People can install solar panels in their home to use less energy.", "Lessen the load of cutting trees so we can preserve wild life environment.", 0.6666666666666666
"stop releasing harmful chemicals in oceans", " People should carpool or use public transport as much as possible to help reduce carbon footprint. ", 1.2
"no use of nuclear or coal energy", "Learn to reuse our resources instead of throwing them away ", 1.0
"Share rides with people when public transportation is inconvenient.", "Factories should cut down on pollution from their production processes.", 0.75
"clean air more efficiently", "Install water saving devices on your faucets and toilets.", 0.8
" Grow fruits and vegetables in your own backyard", "We can take shorter trips, e.g. vacation in a nearby town rather than a country far away, so as to reduce energy waste and emissions.", 0.5
"People can cut down on their red meat consumption.", "Turn the water off on the sink when you brush your teeth", 1.6666666666666667
"People can purchase reusable cups rather than disposable ones.", "Use a carpool or carpooling service to maximize the passengers in a car.", 0.6666666666666666
"Switching gasoline to run on electronic.", "Use the microwave when possible instead of the oven.", 1.2
"clean air more efficiently", "People can purchase recyclable products, again to create less waste but to also use less resources to create more products like trees.", 1.6
"Less use of cars and vehicles", " Boycott companies that aren't certified as having "Green" manufacturing processes.", 1.4
"use central AC/heat less", " People should make a conscious effort to plant trees whenever they can.", 0.75
" change your lawn to astroturf", "If you are not near any form of wilderness then donate to those who are. Wildlife reserves and environmentalists are always looking for more funding to preserve the natural world and you can make a difference in that way.", 0.6666666666666666
"use electric vehicles more", " Use a reusable water bottle", 1.4
" learn how to 3d print food", "People can abstain from buying products made with materials that are less biodegradable. ", 1.2
"Stop eating so much meat, as too many resources go towards raising animals for consumption.", "There should be a new way to confront insects. The sprays they use against them are poisonous. A new way would protect the enviroment.", 1.2
"recyle the waste as much as possible", "We can all do our part on conserving our power usage and consumption.", 2.2
"Use less energy in their homes.", "Wait until they have a full load before doing laundry or starting a dishwasher.", 2.6
"Decreasing Global warming", "Focusing on waste management and reorganizing the business aspect so that all cities and states have the same standards and practices. Once there is one faction there would be less confusion and more focus on the methods to improve waste management can be improved and there for efficient", 1.6
"Wash your clothes in cold water. ", "eliminate wasteful and unnecessary packaging at stores ", 0.2857142857142857
"Use rechargeable instead of disposable batteries", "Recycle more, the less trash thrown away the less new stuff that needs to be created to replace it.", 2.0
"Participate in cleaning up their neighborhood.", "We can drive cars that are more fuel-efficient to cut waste and carbon emissions.", 1.25
"People can make their voices heard and have the government implement restrictions on large industries. Sometimes we don't know how a product that we buy is made. ", " Give bigger tax benefits to companies that use more wind and solar power generation and give them incentives to make the power more affordable to the consumer for more widespread usage.", 2.5
"Grow and buy organic when possible.", "Explore new energy solutions like using wave energy, and algae-carbon harvesting.", 0.6
"Buy less things, especially things that are going to go to waste.", "We can take shorter trips, e.g. vacation in a nearby town rather than a country far away, so as to reduce energy waste and emissions.", 1.6
" Buy produce locally or at a local farmer's market", "Offering adult classes in highschools and colleges where the government provides teachers to educate people on basic practices that help with waste. Also explaining more in depth the issues with chemicals in daily use products and how that effects the water quality all over the world. ", 1.8571428571428572
" Compost yard debris and food waste", "Air out denim jeans as often as possible instead of washing them.", 1.5
" dispose batteries in appropriate bins", " Encourage friends and family to adopt environmentally friendly practices", 1.4
"We could plant more trees ", " Use a low-flow water saving shower head and toilet", 1.25
"People can install solar panels in their home to use less energy.", "Each city should have bus passes given to students in high school and college to then use to save the environment from conjestion and other polution from cars. Car pools and public transportation is the over all goal. ", 2.2857142857142856
"People can use LED light bulbs.", "We can create products that doesn't need to be upgraded as often. Electronic devices could rely on servers instead of inboard processors. This would make it possible to enhance the power of mobile devices without replacing the entire unit. ", 1.6666666666666667
" Boycott companies that aren't certified as having "Green" manufacturing processes.", "We can solve problems in new ways that don't require products that we buy today. We can make roads easier to navigate so that we don't need GPS devices for example. ", 1.5
"People can challenge the food industry to reduce waste.", "People can help pick up litter around their community on a regular basis.", 1.3333333333333333
"Grow your own vegetables and make your own compost out of old food/waste.", "Help countries like Brazil with discounts on food so that they don't deforest the rain forest.", 2.3333333333333335
"People can cut down on their red meat consumption.", "Let grass grow longer before cutting it, which serves a dual purpose, both using less energy to cut, and grass that is longer is slightly more of a carbon sink.", 1.2
"Learn to reuse our resources instead of throwing them away ", "Always report violations whenever you see pollution happening, especially before it gets out of control.", 0.8
" install solar panels or wind turbine ", "People should also eat less meat because the production of meat here in the US plays a big role in global warming. ", 0.4
"Vote out right wing politicians the world wide.", " Properly recycle old electronics instead of throwing them away", 0.5
"stop releasing polluting chemicals from industry", " Donate money to charities that protect the environment", 1.4285714285714286
" Carpool with people that work in the same areas.", " Boycott companies that aren't certified as having "Green" manufacturing processes.", 0.5
"People can replant tress that were cut down either due to logging or damage from weather or accident.", "Being more mindful of recycling. We have the ability to recycle our plastic first and foremost, but other recyclables like glass, cardboard to be reused etc would help preserve the environment, and greatly reduce the impact of waste and waste facilities across the world. ", 2.3333333333333335
"Learn to reuse our resources instead of throwing them away ", "Make a difference in your own community, organize town hall meetings and provide incentives for residents to dispose of any toxic chemicals instead of dumping them. ", 1.4
"All snacks such as chips, candies, cakes and ice cream should have 5 cents deposits for their return like cans and bottles. ", "We can solve problems in new ways that don't require products that we buy today. We can make roads easier to navigate so that we don't need GPS devices for example. ", 0.4
"We could bring our own reusable bags to the shops to cut down on plastic bag and paper bag waste.", "More restaurants/companies should offer discounts for customers to use reusable cups and other items like those instead of new cups/silverware each time they go to the establishment.", 3.0
"People can adopt a vegan diet.", " Choose to work for a company that uses sustainable and green practices", 1.4
"Use non-toxic natural cleaners when possible. ", "Change water usage, shorter showers and use a dishwasher instead of washing by hand.", 0.8
"We could plant more trees ", " reduce your use of paper - print and write on both sides of each page", 1.25
" Use public transportation whenever possible.", "if possible, make showers/bath and washing machines drain to your yard", 1.0
"Buy less things, especially things that are going to go to waste.", "Make a difference in your own community, organize town hall meetings and provide incentives for residents to dispose of any toxic chemicals instead of dumping them. ", 1.6
" Don't pour soap or chemicals down the storm drain", " Plant trees or other plants around your community", 0.8333333333333334
"We can cut down on unnecessary driving, e.g. by walking instead.", "People can fund a donation drive where he donation can be used to buy solar panels for old buildings in their neighborhood. Getting these old, energy-inefficient off the grid will help the environment but reducing the building's carbon footprint.", 1.4
"Change water usage, shorter showers and use a dishwasher instead of washing by hand.", "Recycle more, the less trash thrown away the less new stuff that needs to be created to replace it.", 1.25
"We can stop using disposable plastic straws.", "install an RO system in home instead of buying bottled water", 2.5
"Do not burn yard debris and waste ", "We could all work together and get on the same page and do something to prevent global warming from worsening ", 1.2
" Use public transportation whenever possible.", "One can preserve the environment by using less raw materials. One can be careful to maintain their belongings so they do not have to replace items. ", 1.5714285714285714
"Be careful when lighting fires/putting out fires in nature.", "People can switch off devices that they aren't using. We spend too much time on our computers now days and sometimes it's good to just turn them off so that we can enjoy life more stress free. This will save power and therefor the environment. ", 0.5
"avoid using plastic plates, cups, dishware", "install an RO system in home instead of buying bottled water", 1.4
"People can use LED light bulbs.", "Stop using plastics as a disposable product like straws or bags.", 1.0
"clean air more efficiently", "We can all do our part on conserving our power usage and consumption.", 0.4
"Create more efficient battery technology.", "People can aim to inspire others to adopt a more eco-friendly lifestyle.", 1.0
"Stop procreating at such a fast clip.", "use solar or wind energy only to generate elctricity", 0.4
"change every bulb in your home to LED", " Take public transportation when possible", 2.0
"We can chose not to liter the earth with our garbage.", "Help educate others on the dangers of harming the environment", 1.8
