ID,CREATED,DESCRIPTION,CHALLENGE,,LENGTH(DESCRIPTION)
10237,2018+AC0-12+AC0-03 18:30:36.476,Changing the world starts at a community and personal level first.Everyone could start by conserving energy in multiple ways. Recycling is one of the easiest ways that people can make a difference. Plastic is one of the biggest offenders of pollution so everyone recycling at home is a great start.,cc19 pilot study environment,,298
10279,2018+AC0-12+AC0-03 19:06:53.914,+ACI-Buy energy conservation electric products. There are many products on the market that are labeled for conserving energy in your daily life, and should be considered a worthwhile purchase. Not only will it save you money in your electric bill in the long run, but it's also good for the environment+ACE-+ACI-,cc19 pilot study environment,,298
10465,2018+AC0-12+AC0-04 15:38:01.098,Ads being run daily and in frequent icrements on the tax deductions available to citizens if they implement certain environmentally saving items. If people are made aware they could save money by spending some they would be more inclined to put the effort in and would help the environment at the same time. ,cc19 pilot study environment,,308
10271,2018+AC0-12+AC0-03 19:03:10.395,+ACI-Carpooling or public transportation. If you have to go somewhere, travel in groups to avoid multiple cars providing harmful emissions to the environment, or take a bus in which others are doing as well. Even one trip like this a week in the grand scheme of things can be very helpful for the environment overall. +ACI-,cc19 pilot study environment,,313
10268,2018+AC0-12+AC0-03 19:02:20.521,+ACI-Transportation is a big issue in itself, if you are driving a gas powered car, being mindful of your emissions is a great way to preserve the environment. Avoid letting your car run idle in lines, or warming up in the winter. Turning your car off to reduce harmful emissions can go a long way for just a short period of time a day. +ACI-,cc19 pilot study environment,,332
10448,2018+AC0-12+AC0-04 15:33:54.689,All faucets in rented homes and apartments must come with a filter and tenants can pay for the replacements and maintanence with their monthly fees. It would decrease the use of bottle water and that means less plastic and waste. Also provide a tax deduction for home owners who provide proof of water filters in their homes systems,cc19 pilot study environment,,332
10273,2018+AC0-12+AC0-03 19:04:31.929,+ACI-Reducing your footprint from an energy standpoint. Turning off lights when you leave the room, or unplugging appliances that aren't an every day use can go a long way in preserving the environment. If everyone were to follow this simple model that only takes up brief seconds of your day, we can all do a part in preserving the environment. +ACI-,cc19 pilot study environment,,341
10461,2018+AC0-12+AC0-04 15:36:24.024,Legalizing all drug use and create goverment buildings to sell the drugs with restrictions for safety and taking the proceeds to then put back into the cities locally. The cities will be better structured and traffic studies can be done to help lower conjestion and then less traffic means less smog and other polution from cars as they will be on the road less. ,cc19 pilot study environment,,363
10282,2018+AC0-12+AC0-03 19:08:08.763,+ACI-Recycle your electronics instead of throwing them away. Electronics are a daily way of life, from cell phones to mp3 players. Nearly everyone has at least one electronic at their disposal. If it breaks or malfunctions, instead of tossing it in the trash, recycle it. Many phone companies have recycling containers for old phones, and should be used to help preserve the environment. +ACI-,cc19 pilot study environment,,383
10277,2018+AC0-12+AC0-03 19:05:48.301,+ACI-Plant and harvest your own garden. While you might not realize it, this can reduce the harmfulness to the environment overall. If you have your own garden, you make less trips to the store to buy fruit and vegetables, and you get to reap the rewards of having your own little farm in your backyard. This is a great way to preserve the environment that many use, but even more do not. +ACI-,cc19 pilot study environment,,384
10256,2018+AC0-12+AC0-03 18:53:42.092,+ACI-Removing plastic straws from out everyday life. Something that's gained traction as of late are the immense use of plastic straws and how many of them end up in the ocean vastly damaging species in the ocean and all waterlife overall. Implimenting reusable straws, or even paper straws as some companies have started to do, would greatly improve the impact they have on the environment. +ACI-,cc19 pilot study environment,,387
10490,2018+AC0-12+AC0-04 15:47:03.569,In each grade level in schools there should be an additional subject on environmental safety practices. In the beginning years when a child is too young to truly help we can focus on developing other skills with the use of environmental topics for example gardening is helpful with motor and creativity but overall teaches renewable sources and independence. Higher ages can do more in depth work and studies.,cc19 pilot study environment,,409
10523,2018+AC0-12+AC0-04 16:18:55.275,+ACI-All states should have deposit returns for their snacks such as cakes,candies, ice cream and chips like they have for bottles and cans.  An example is instead of throwing out thier cakes,candies, ice cream and chips wrappers they would bring them back to thier local redemption center and be paid .5 cents each like they do with bottles and cans. This would encourage people to recycle instead of throwing away the wrappers out in the wild+ACI-,cc19 pilot study environment,,439
10260,2018+AC0-12+AC0-03 18:58:19.419,+ACI-Stop the use of aerosol cans all together. We've made great strides to remove the use of aerosol cans such as in hair spray which was used 20+AC0-30 years ago, to how much is used today which has already made a great impact on preserving the environment. Although, there are still many cans on the market that can be produced differently that would have much less of an impact. Removing these from stores in general should be an easy move to help preserve the environment. +ACI-,cc19 pilot study environment,,469
10257,2018+AC0-12+AC0-03 18:55:10.662,+ACI-Move forward towards more electric cars. Electricity is a much much less environmental impact than gas emissions. For far too long the world has relied on gas for transportation, and while electric cars are currently on the market, they're just not yet at a widespread ownership by consumers due to availability and ease of use from the customer's standpoint. It's much easier to find a gas station than a charging station for your car, especially in rural communities. +ACI-,cc19 pilot study environment,,470
10264,2018+AC0-12+AC0-03 19:01:22.626,+ACI-Purchase and use more reusable products. There are a wide variety of reusable and recycled products on the market today, but too often people are set in their ways of buying what they're used to, regardless of the impact to the environment. Purchasing more feasible options to preserve the environment should be a goal we all share, and just needs a small change to have very drastic improved results. Reusable cups, plates, things made from recycled materials, could all help greatly. +ACI-,cc19 pilot study environment,,486
