ID,CREATED,DESCRIPTION,CHALLENGE,LENGTH(DESCRIPTION)
10806,2018+AC0-12+AC0-19 17:33:25.843,+ACI-Imagine making flexible masks out of that fabric and displaying someone else's face on it. Or anything else, any image could be displayed to express emotions or ideas.+ACI-,cc19 c3 fabric display,167
10808,2018+AC0-12+AC0-19 17:36:33.511,It could be used instead of art on walls. The fact that it would be really easy to change the display would mean you can change the art on your walls whenever you want.,cc19 c3 fabric display,168
11057,2019+AC0-01+AC0-04 23:34:42.408,Hand the cloth on the walls in a frame so that you can change the artwork around your house to whatever you want. It could be paintings of family photos or anything really.,cc19 c3 fabric display,172
10957,2019+AC0-01+AC0-03 14:58:59.506,Taxis and autonomous vehicles could have back seats covered in the fabric display. Customers could use it to keep track of their route and make changes to their destination. ,cc19 c3 fabric display,174
10987,2019+AC0-01+AC0-04 20:04:55.595,It can be used on plain tshirts and come with images that can be chosen on a day to day basis. This will cut down on clutter in wardrobes and can be customized on the individual.,cc19 c3 fabric display,178
11061,2019+AC0-01+AC0-04 23:44:31.75,Life size video calling feature. Have the fabric hanging from a location in a conference room so you can see a life size display of the person on the other end of the phone call.,cc19 c3 fabric display,178
10714,2018+AC0-12+AC0-19 14:48:38.004,It could work like one of those amazon purchase buttons and be displayed in the  laundry room on the ironing board fabric.  People could order new products for laundry through it.,cc19 c3 fabric display,179
10821,2018+AC0-12+AC0-19 18:05:47.368,It could be used as a bag for groceries and you could keep your grocery list on it. That way when you shopped you would have your list and know what is needed so you don't forget.,cc19 c3 fabric display,179
10709,2018+AC0-12+AC0-19 14:36:06.683,+ACI-Clothing with the technology that automatically senses and adapts to the surrounding environment, turning the same color or pattern so that you blend in, like high tech camouflage +ACI-,cc19 c3 fabric display,180
10732,2018+AC0-12+AC0-19 15:18:59.73,You could have this fabric to drape over bushes or the fronts of homes for different holiday decorations.  You could paint a scene yourself or touch it to decide on preset scenes.  ,cc19 c3 fabric display,181
10940,2019+AC0-01+AC0-03 14:50:14.154,Space saving and power saving options. The fabric is thinner and lighter so you could reduce weight on planes and save fuel by replacing electronic screens with the fabric display.,cc19 c3 fabric display,181
10692,2018+AC0-12+AC0-19 14:26:34.468,+ACI-It could be possible to replace smart watches with smart cuffs on clothing to eliminate or mirror the displays that would otherwise be on a watch, lessening the necessity for another item.+ACI-,cc19 c3 fabric display,188
11042,2019+AC0-01+AC0-04 22:53:44.503,Touch screen fabric could be used to create advertising on demand for t+AC0-shirts.  Promoters could select the advertising they want to present and play it as needed to fit their surroundings.,cc19 c3 fabric display,189
10867,2019+AC0-01+AC0-03 13:17:19.704,This could be used on the anti+AC0-theft devices sometimes placed into clothing to show the user how they look when wearing the item. The device would be of course returned at the point of sale.,cc19 c3 fabric display,190
10880,2019+AC0-01+AC0-03 13:20:50.217,+ACI-A cloth wallet that changes color / texture / pattern, keeps track of how much  money you're spending or have, and also has digital pictures of your family, reminders, etc. Like an organizer.+ACI-,cc19 c3 fabric display,191
10824,2018+AC0-12+AC0-19 18:12:06.457,You could make anything easy to put away that way you could have a device that was easy to store and useful. There would be easy access to it and you could use it how you want and when you want.,cc19 c3 fabric display,194
10822,2018+AC0-12+AC0-19 18:07:29.991,It could be used as a cushion that way if you were on the couch a tablet would be there and if you wanted to look something up you it would be there so you could find out what you wanted to know. ,cc19 c3 fabric display,196
10883,2019+AC0-01+AC0-03 13:22:01.334,A mousepad that is also a note tool. You can hold a button on your keyboard and then click on a note on your pad to activate that activity on your computer to get more information / take care of it.,cc19 c3 fabric display,198
10804,2018+AC0-12+AC0-19 17:30:44.6,+ACI-It could be connected to an a tablet or phone or other mobile device where the user would draw +AC0- the drawing could be displayed on the fabric, which could be used for clothing or as a wall decoration.+ACI-,cc19 c3 fabric display,200
10933,2019+AC0-01+AC0-03 14:47:18.845,Making things for newborn babies that showed their mother or the ability to change the picture to mentally stimulate in ways. Interacting with kids could draw their attention to stop crying or outbursts. ,cc19 c3 fabric display,205
10679,2018+AC0-12+AC0-19 14:18:37.588,+ACI-It could be a foldable screen size fabric that people can carry around with them folded in the back of their pants pockets or purse. When they need to look up images or videos, they can pull out the fabric.+ACI-,cc19 c3 fabric display,206
10964,2019+AC0-01+AC0-03 15:03:35.43,+ACI-Putting your own fabric to the display, it will scan it, giving detailed information on what you're wearing. Even then, it will give you information on what else around you is comprised of the same fabrics.+ACI-,cc19 c3 fabric display,206
10807,2018+AC0-12+AC0-19 17:35:30.34,+ACI-You could use this fabric on a panel on the tummy of a plush animal so a child could communicate with it through images and simple words. It could teach the child concepts, or simply have conversations with him/her.+ACI-,cc19 c3 fabric display,215
10998,2019+AC0-01+AC0-04 20:22:16.16,+ACI-some sort of device that can precisely and quickly render all the textures/colors of the surroundings and transmit that to the fabric display which could entirely cover someone, rendering them effectively invisible.+ACI-,cc19 c3 fabric display,215
10662,2018+AC0-12+AC0-19 14:10:59.553,The fabric display could be made into a shirt for people that struggle or are in danger of heart attacks. Maybe there could be a button you can press and the shirt shows a screen that tells people what the heartrate is.,cc19 c3 fabric display,220
10815,2018+AC0-12+AC0-19 17:55:36.485,It could be used in the kitchen to display recipes on a kitchen towel. That way they would be there for you whenever you needed them and you wouldn't have to worry about them not being their when you needed to make something.,cc19 c3 fabric display,225
10816,2018+AC0-12+AC0-19 17:57:47.919,You could use them do display movies in places where tv just wasn't there. You could select what you wanted to see and it would show it for you. It would have a good selection it could be streaming so there isn't any memory. ,cc19 c3 fabric display,225
10721,2018+AC0-12+AC0-19 14:54:36.597,Could be used as a tool for kids entertainment in those little playhouses they have in museums +AC0- you crawl through a tunnel into a bigger room where there is a projector displaying an interesting fact or show about an exhibit.,cc19 c3 fabric display,226
10811,2018+AC0-12+AC0-19 17:41:04.418,+ACI-Used to make a garment, it would enable the user to change the print on the garment as often as desired. One would not need to buy as many shirts for example, since the color and print on the shirt could change from day to day.+ACI-,cc19 c3 fabric display,227
11001,2019+AC0-01+AC0-04 20:30:45.029,+ACI-For hotels+AC0- guests could customize their rooms if this fabric was used to, say, cover the walls.  Guests could change the color of the room, make the walls videos, whatever they wanted.  Hotels could have templates to choose from.+ACI-,cc19 c3 fabric display,230
10820,2018+AC0-12+AC0-19 18:03:44.76,It could be used as a device that is easy to keep with you and could help you with your day to day stuff. If you forgot something it could remind you. or if you needed help or directions it could be used so you could get advice you need.,cc19 c3 fabric display,237
10819,2018+AC0-12+AC0-19 18:01:45.26,It could be used as a covering for a sofa. It could change patterns and it would create patterns however you wanted. It could suggest patterns and if you liked them you could select that. If not you would just tell it the pattern you wanted. ,cc19 c3 fabric display,242
10823,2018+AC0-12+AC0-19 18:10:05.887,You could use it as a table cloth. When you eat dinner you could play games on it. Learn new things. Watch discussions on subjects. That way dinner would be funner. When it got dirty you could just clean it because it's made of fabric and easy to clean. ,cc19 c3 fabric display,254
10825,2018+AC0-12+AC0-19 18:14:30.846,You could just have a cloth you could put on your closet door. That way for those who like to stay organized could keep there wardrobe organized and know what they are going to wear for the day or week and it would be convenient because it's not in the way.,cc19 c3 fabric display,257
10947,2019+AC0-01+AC0-03 14:53:11.831,+ACI-The kind of thing that can do this, is something like a tablet that scans the fabrics then bringing them up upon a screen detailing what can be made through them. Giving a brief assessment of how much you will be needing for a certain item you want to make.+ACI-,cc19 c3 fabric display,257
10726,2018+AC0-12+AC0-19 15:11:06.439,You could make fabric window blinds with a picture on the outside that could be activated remotely when you are not at home.  It could make it appear that the TV is on or that there are people in the room.  This could also be the inside of curtains and not necessarily blinds.  ,cc19 c3 fabric display,278
10813,2018+AC0-12+AC0-19 17:43:13.029,+ACI-It could be used instead of paper +AC0- it would be more resistant, one could crumple it or fold it in a tiny square many times without damaging it. So you could have books or magazines that could be kept and carried around, folded away etc. and updated with new information, articles etc.+ACI-,cc19 c3 fabric display,285
10730,2018+AC0-12+AC0-19 15:16:36.063,+ACI-You could cover a wall in a room with this fabric for an interactive mural that displays different scenes.  The advantage of this over a full wall+AC0-sized screen is that it should be cheaper, and when the display is not in use, it could just look like normal wallpaper rather than as a screen that is turned off. +ACI-,cc19 c3 fabric display,311
10695,2018+AC0-12+AC0-19 14:28:44.938,+ACI-Similarly, replacing the armband playbook on a quarterback's arm with a smart technology would make so much information display on a little item much easier. A coach could also make playcalls digitally through the armband for the quarterback's viewing as well. This could be tailored to other sports with setplays as well.+ACI-,cc19 c3 fabric display,322
10731,2018+AC0-12+AC0-19 15:18:01.769,+ACI-You could have a mask that is covered with this fabric and can be changed to different characters.  So, if your kid decides at the last minute that they want to be a werewolf instead of frankenstein, it would be easy to touch the screen to change.  Also, a child could create their own mask by +ACIAIg-coloring+ACIAIg- it in and express their creativity.  +ACI-,cc19 c3 fabric display,342
10809,2018+AC0-12+AC0-19 17:38:16.692,+ACI-Stretching the idea of using it as a wall covering +AC0- whole rooms could be papered with it, or a wall here and there could be, in order to completely change the look of a room. You know how strategically placed mirrored walls can make a room look bigger, or change it into a maze, like in a house of mirrors? You could do that with wall covering using that technology.+ACI-,cc19 c3 fabric display,367
10728,2018+AC0-12+AC0-19 15:14:17.087,+ACI-You could replace curtains on a stage with curtains made out of this material that could be activated during a performance to display different scenes to go along with the show, and the actors could interact with +ACIAIg-objects+ACIAIg- on the display.  For example, if a husband and wife are talking in a kitchen, the wife could be standing in front of a stove and by a press she could +ACIAIg-turn on' the stove.  +ACI-,cc19 c3 fabric display,395
10735,2018+AC0-12+AC0-19 15:24:43.572,+ACI-You could make doll facts out of this fabric that can be changed by a touch and animated so that it reacts to a child's commands.  It would be more realistic than an animatronic type of doll.  In fact, you could use this type of fabric in all kinds of ways in an amusement park like Disney World to create special effects that will wow on a ride.  For example, you could have screens that drop then pull back up with animation  while on a roller coaster.  +ACI-,cc19 c3 fabric display,456
10814,2018+AC0-12+AC0-19 17:46:56.902,+ACI-It could be used to wrap things: products, presents, etc. Imagine wrapping a present with it and giving the present to someone. Of course you would choose whatever image or print you want for that particular person and gift. The person would then reuse the wrapper to give something else to someone else, or give it back to you. People would end up having those those wrappers at home and could reuse them and pass them on endlessly, or at least for a long time.+ACI-,cc19 c3 fabric display,462
