ID,CREATED,DESCRIPTION,CHALLENGE,LENGTH(DESCRIPTION)
11008,2019+AC0-01+AC0-04 21:14:07.507,A hat with memes on it.,cc19 c3 fabric display,23
10702,2018+AC0-12+AC0-19 14:32:09.972,track someone who is lost,cc19 c3 fabric display,25
10689,2018+AC0-12+AC0-19 14:25:12.883,You could use it as a tablet.,cc19 c3 fabric display,29
10967,2019+AC0-01+AC0-03 15:04:53.601,Sporting event memorabilia.  ,cc19 c3 fabric display,29
10994,2019+AC0-01+AC0-04 20:15:19.543,smaller laptops with no display,cc19 c3 fabric display,31
10682,2018+AC0-12+AC0-19 14:21:02.068,it could be use to spy on someone,cc19 c3 fabric display,33
10696,2018+AC0-12+AC0-19 14:29:24.555,A shirt that shows sports videos,cc19 c3 fabric display,33
10760,2018+AC0-12+AC0-19 16:52:16.272,you can have changing car decals,cc19 c3 fabric display,33
10877,2019+AC0-01+AC0-03 13:19:44.958,It could be used as a pedometer.,cc19 c3 fabric display,33
10853,2019+AC0-01+AC0-03 13:12:32.699,You could use this as a projector.,cc19 c3 fabric display,34
10993,2019+AC0-01+AC0-04 20:13:52.395,Mini projector for movies et al.  ,cc19 c3 fabric display,34
10690,2018+AC0-12+AC0-19 14:25:23.769,You could use it as a charging pad.,cc19 c3 fabric display,35
10761,2018+AC0-12+AC0-19 16:53:04.436,you can have interactive subway maps,cc19 c3 fabric display,36
10834,2018+AC0-12+AC0-19 18:21:05.838,Write recipes/ingredients on aprons,cc19 c3 fabric display,36
11004,2019+AC0-01+AC0-04 21:11:05.025,+ACI-Shirt cuffs with a built+AC0-in +ACIAIg-watch+ACIAIg-.+ACI-,cc19 c3 fabric display,36
10677,2018+AC0-12+AC0-19 14:17:37.784,it could be use to catch porch pirates,cc19 c3 fabric display,38
10693,2018+AC0-12+AC0-19 14:28:18.69,You could use it as a photo projector.,cc19 c3 fabric display,38
10787,2018+AC0-12+AC0-19 17:18:49.426,shoes can display high quality images,cc19 c3 fabric display,38
10793,2018+AC0-12+AC0-19 17:21:42.751,blankets can have cool images on them,cc19 c3 fabric display,38
10842,2018+AC0-12+AC0-19 18:35:22.365,videos as part of Halloween costumes.,cc19 c3 fabric display,38
10891,2019+AC0-01+AC0-03 13:25:03.608,This could be used to make camouflage.,cc19 c3 fabric display,38
11013,2019+AC0-01+AC0-04 21:27:01.304,+ACI-I can't think of anything else, sorry.+ACI-,cc19 c3 fabric display,38
10876,2019+AC0-01+AC0-03 13:19:41.164,It could be used as a glucose monitor.,cc19 c3 fabric display,39
10895,2019+AC0-01+AC0-03 13:25:49.547,This could be used in laser tag games.,cc19 c3 fabric display,39
10683,2018+AC0-12+AC0-19 14:21:38.427,could be useful to help law enforcement ,cc19 c3 fabric display,40
10710,2018+AC0-12+AC0-19 14:36:47.67,a shirt that copies other peoples shirts,cc19 c3 fabric display,40
10694,2018+AC0-12+AC0-19 14:28:42.18,You could use it as a projection screen.,cc19 c3 fabric display,40
10687,2018+AC0-12+AC0-19 14:23:49.721,uber/lyft could use it to track passengers,cc19 c3 fabric display,42
10929,2019+AC0-01+AC0-03 14:45:54.758,Home projection screen for movie watching.,cc19 c3 fabric display,42
11005,2019+AC0-01+AC0-04 21:11:53.587,Book covers with changeable cover designs.,cc19 c3 fabric display,42
10670,2018+AC0-12+AC0-19 14:15:35.356,A T+AC0-shirt that displays photos of your pets,cc19 c3 fabric display,43
10674,2018+AC0-12+AC0-19 14:16:27.307,A shirt that displays your computer screen,cc19 c3 fabric display,43
10781,2018+AC0-12+AC0-19 17:16:59.901,shirts that can display images on the front,cc19 c3 fabric display,43
10948,2019+AC0-01+AC0-03 14:53:18.179,Wearable accessories such as watch screens.,cc19 c3 fabric display,43
10841,2018+AC0-12+AC0-19 18:34:51.481,Product demonstration video for salespeople,cc19 c3 fabric display,44
10763,2018+AC0-12+AC0-19 16:53:32.439,you have easy green screens for video makers,cc19 c3 fabric display,45
10827,2018+AC0-12+AC0-19 18:16:04.793,+ACI-Individual +ACIAIg-sketch pads+ACIAIg- for school children+ACI-,cc19 c3 fabric display,45
11007,2019+AC0-01+AC0-04 21:12:17.828,Wallpaper that changes patterns with a touch.,cc19 c3 fabric display,45
10678,2018+AC0-12+AC0-19 14:18:03.242,it could be used to catch criminals in the act,cc19 c3 fabric display,46
10778,2018+AC0-12+AC0-19 17:13:04.803,Color shifting clothing for circus performers.,cc19 c3 fabric display,46
10875,2019+AC0-01+AC0-03 13:19:37.037,It could be used as a blood pressure monitor.,cc19 c3 fabric display,46
10911,2019+AC0-01+AC0-03 13:33:32.501,This could be used to illuminate dark spaces.,cc19 c3 fabric display,46
10915,2019+AC0-01+AC0-03 14:09:04.69,Turning clothing into personal movie theaters.,cc19 c3 fabric display,46
10931,2019+AC0-01+AC0-03 14:47:00.099,advertising opportunities for stores or shows,cc19 c3 fabric display,46
10969,2019+AC0-01+AC0-03 15:26:26.132,Use it to promote energy saving advertisement.,cc19 c3 fabric display,46
10839,2018+AC0-12+AC0-19 18:28:28.156,banner with picture of the couple at a wedding,cc19 c3 fabric display,47
10747,2018+AC0-12+AC0-19 15:45:32.69,Builders could use fabric to display blueprints.,cc19 c3 fabric display,48
10785,2018+AC0-12+AC0-19 17:18:16.455,Awnings that can display digital advertisements.,cc19 c3 fabric display,48
10975,2019+AC0-01+AC0-03 15:32:38.009,Put Artists info on tshirts to buy at concerts.,cc19 c3 fabric display,48
10672,2018+AC0-12+AC0-19 14:15:51.912,A shirt that displays photos of family or friends,cc19 c3 fabric display,49
10788,2018+AC0-12+AC0-19 17:19:15.586,hats can have very cool images displayed on them,cc19 c3 fabric display,49
10836,2018+AC0-12+AC0-19 18:24:09.853,Signs and pennants for display at baseball games,cc19 c3 fabric display,49
10664,2018+AC0-12+AC0-19 14:14:17.928,You could watch movies on any fabric that you own.,cc19 c3 fabric display,50
10779,2018+AC0-12+AC0-19 17:14:54.981,Bed sheets that display your favorite photographs.,cc19 c3 fabric display,50
10921,2019+AC0-01+AC0-03 14:34:52.897,Ability to customize your wardrobe to your taste. ,cc19 c3 fabric display,50
10953,2019+AC0-01+AC0-03 14:55:44.329,Team uniforms showing animated logos and mascots. ,cc19 c3 fabric display,50
10691,2018+AC0-12+AC0-19 14:26:12.439,It could be used to catch cheaters in relationships,cc19 c3 fabric display,51
10762,2018+AC0-12+AC0-19 16:53:17.416,you can have interactive flight charts in airports,cc19 c3 fabric display,51
10840,2018+AC0-12+AC0-19 18:32:02.924,Keep score of a game right on the players' shirts.,cc19 c3 fabric display,51
10905,2019+AC0-01+AC0-03 13:29:41.177,Some really cool shoes could be designed with this.,cc19 c3 fabric display,51
10912,2019+AC0-01+AC0-03 14:07:48.529,Paying people to advertise products on their shirts.,cc19 c3 fabric display,52
10704,2018+AC0-12+AC0-19 14:33:10.126,A shirt that will display home movies or other video,cc19 c3 fabric display,53
10913,2019+AC0-01+AC0-03 14:08:11.542,A rotating display of protest slogans during marches.,cc19 c3 fabric display,53
10972,2019+AC0-01+AC0-03 15:28:50.139,Drivers at airport could use it to alert their fare.,cc19 c3 fabric display,53
10671,2018+AC0-12+AC0-19 14:15:36.97,maybe use it to find and locate a lost piece of fabric,cc19 c3 fabric display,54
10703,2018+AC0-12+AC0-19 14:32:55.392,A hat that displays any image or video you want on it,cc19 c3 fabric display,54
10828,2018+AC0-12+AC0-19 18:16:20.751,change the print on your clothing daily or more often,cc19 c3 fabric display,54
10830,2018+AC0-12+AC0-19 18:18:51.257,design textile patterns to be uploaded for production,cc19 c3 fabric display,54
10968,2019+AC0-01+AC0-03 15:25:39.961,Use it as a walking billboard to advertise a business.,cc19 c3 fabric display,54
10700,2018+AC0-12+AC0-19 14:31:10.569,A shirt that advertises for charities that you support,cc19 c3 fabric display,55
10766,2018+AC0-12+AC0-19 16:57:02.657,you can customize almost anything with a new background,cc19 c3 fabric display,55
10958,2019+AC0-01+AC0-03 14:59:18.544,You could use this to advertise things on your clothes.,cc19 c3 fabric display,55
10790,2018+AC0-12+AC0-19 17:20:39.14,cars can make displays cheaper on the back of car seats,cc19 c3 fabric display,56
10801,2018+AC0-12+AC0-19 17:29:55.256,tents can now be lit up with images and be more exciting,cc19 c3 fabric display,56
10857,2019+AC0-01+AC0-03 13:14:03.059,You could use this as a button for a fashion accessory.,cc19 c3 fabric display,56
10861,2019+AC0-01+AC0-03 13:15:09.506,This could be used to do high resolution medical scans.,cc19 c3 fabric display,56
11002,2019+AC0-01+AC0-04 21:08:49.335,You could have shirts with changeable patterns/graphics.,cc19 c3 fabric display,56
10803,2018+AC0-12+AC0-19 17:30:39.465,restaurants might be able to use more vibrant tablecloths,cc19 c3 fabric display,57
10826,2018+AC0-12+AC0-19 18:15:44.171,frame and use for menu board at restaurant or coffee shop,cc19 c3 fabric display,57
10954,2019+AC0-01+AC0-03 14:56:53.33,Thinner screens could be made for service industry jobs. ,cc19 c3 fabric display,57
10835,2018+AC0-12+AC0-19 18:23:39.99,Impromptu matching outfits for friends going out together,cc19 c3 fabric display,58
10894,2019+AC0-01+AC0-03 13:25:45.09,This could be used as a ice skating performance enhancer.,cc19 c3 fabric display,58
10910,2019+AC0-01+AC0-03 13:32:26.563,This could be used to make different appearing bed sheets.,cc19 c3 fabric display,58
10976,2019+AC0-01+AC0-03 15:33:50.27,Put it on a baby crib hanging toy to keep their attention,cc19 c3 fabric display,58
10698,2018+AC0-12+AC0-19 14:30:34.247,A shirt or clothing that serves as a walking advertisement,cc19 c3 fabric display,59
10774,2018+AC0-12+AC0-19 17:09:42.508,Interactive board game carpets. Become a human game piece. ,cc19 c3 fabric display,59
10673,2018+AC0-12+AC0-19 14:16:18.904,A shirt or piece of clothing that displays your phone screen,cc19 c3 fabric display,60
10802,2018+AC0-12+AC0-19 17:30:24.685,street vendors can now display their carts more efficiently,cc19 c3 fabric display,60
10848,2018+AC0-12+AC0-19 18:59:07.402,A display on your shirt sleeve that can tell you the time. ,cc19 c3 fabric display,60
10878,2019+AC0-01+AC0-03 13:20:11.723,It could be used for displaying things on a bulletin board.,cc19 c3 fabric display,60
10887,2019+AC0-01+AC0-03 13:23:27.014,This could be used to create an invisibility cloak. Really.,cc19 c3 fabric display,60
10740,2018+AC0-12+AC0-19 15:33:41.401,Fabric displays could be used as menu boards in restaurants. ,cc19 c3 fabric display,61
10859,2019+AC0-01+AC0-03 13:14:41.903,This could be used to validate coins and detect counterfeits.,cc19 c3 fabric display,61
10985,2019+AC0-01+AC0-04 19:56:30.154,In the NFL on a wrist wrap for quarterbacks to use for plays.,cc19 c3 fabric display,61
10792,2018+AC0-12+AC0-19 17:21:09.286,Interactive tapestries that help children learn about history.,cc19 c3 fabric display,62
10794,2018+AC0-12+AC0-19 17:22:13.007,people have the freedom to customize their clothes with images,cc19 c3 fabric display,62
10831,2018+AC0-12+AC0-19 18:19:17.531,Use for a tablecloth and indicate where the place settings go,cc19 c3 fabric display,62
10767,2018+AC0-12+AC0-19 16:57:13.562,you can have sports games play in picture frames of a man cave,cc19 c3 fabric display,63
10764,2018+AC0-12+AC0-19 16:53:47.625,you can make video editing a lot easier with changing backgrounds,cc19 c3 fabric display,65
10829,2018+AC0-12+AC0-19 18:16:41.166,make a note of a name or phone number if your phone is not handy,cc19 c3 fabric display,65
10863,2019+AC0-01+AC0-03 13:15:41.161,+ACI-This could be used in car seats, airplane seats, or train seats.+ACI-,cc19 c3 fabric display,65
10768,2018+AC0-12+AC0-19 17:02:22.508,broadcasts movies in your basement like a movie theater for cheap,cc19 c3 fabric display,66
10798,2018+AC0-12+AC0-19 17:24:56.667,sports teams can now put more logos on their uniforms efforlessly,cc19 c3 fabric display,66
10771,2018+AC0-12+AC0-19 17:07:18.087,Wall+AC0-sized sheets that could replace TVs or projectors and screens.,cc19 c3 fabric display,67
10956,2019+AC0-01+AC0-03 14:58:50.828,This could be used to make your Halloween costume more interesting.,cc19 c3 fabric display,67
10973,2019+AC0-01+AC0-03 15:30:36.184,Put it on curtains to simulate a scene like a hillside and sunset.,cc19 c3 fabric display,67
10902,2019+AC0-01+AC0-03 13:28:48.698,Would be neat on a hat to change sports teams or logos as you wish.,cc19 c3 fabric display,67
10775,2018+AC0-12+AC0-19 17:10:45.731,Floor mats that can be used for foot+AC0-control of video game consoles.,cc19 c3 fabric display,68
10789,2018+AC0-12+AC0-19 17:19:59.446,Curtains that display different images depending on the time of day.,cc19 c3 fabric display,68
10914,2019+AC0-01+AC0-03 14:08:41.241,High speed communications in remote locations for rescue situations.,cc19 c3 fabric display,68
10934,2019+AC0-01+AC0-03 14:47:35.626,interactive art shows where gallery viewers can change the exhibit. ,cc19 c3 fabric display,68
10772,2018+AC0-12+AC0-19 17:07:29.821,free internet access with this connector no matter where the user is.,cc19 c3 fabric display,69
10909,2019+AC0-01+AC0-03 13:32:03.932,I guess you could buy less of clothes and change the look day to day.,cc19 c3 fabric display,69
11009,2019+AC0-01+AC0-04 21:14:30.236,Could be used in personal computing devices to keep the weight lower.,cc19 c3 fabric display,69
11011,2019+AC0-01+AC0-04 21:20:01.111,+ACI-Vehicle covers that reflect or absorb light, depending on the season.+ACI-,cc19 c3 fabric display,69
10697,2018+AC0-12+AC0-19 14:29:39.775,A shirt that displays logos and pictures of your favorite sports team,cc19 c3 fabric display,70
10743,2018+AC0-12+AC0-19 15:37:34.963,+ACI-When working in a kitchen, recipes could be displayed on dish towels. +ACI-,cc19 c3 fabric display,70
10893,2019+AC0-01+AC0-03 13:25:26.576,This could be used in theatrical performances when the lights are off.,cc19 c3 fabric display,71
10874,2019+AC0-01+AC0-03 13:19:23.46,It could be used as a watch that is attachable to clothing as a button.,cc19 c3 fabric display,72
10978,2019+AC0-01+AC0-03 15:40:57.799,Could make animal clothes and put advertisement on it like a billboard.,cc19 c3 fabric display,72
10981,2019+AC0-01+AC0-03 15:46:21.956,Could use it at sports competition to keep score on if worn as a tshirt,cc19 c3 fabric display,72
11041,2019+AC0-01+AC0-04 22:52:51.376,Touch screen fabric could be used to create faux fireplaces in any room.,cc19 c3 fabric display,72
11051,2019+AC0-01+AC0-04 23:29:09.685,Shirts than can change the design of what it looks like whenever needed.,cc19 c3 fabric display,72
10758,2018+AC0-12+AC0-19 16:50:51.301,+ACI-you could have changing pictures on your wall, that play like slideshows+ACI-,cc19 c3 fabric display,73
10791,2018+AC0-12+AC0-19 17:21:01.235,easier to design clothes without having to spend money on printing or ink,cc19 c3 fabric display,73
10886,2019+AC0-01+AC0-03 13:23:13.017,+ACI-A comfortable sock that measures your blood pressure, pulse, steps, etc. +ACI-,cc19 c3 fabric display,73
10995,2019+AC0-01+AC0-04 20:16:42.336,underwater technology that could make use of hydrophobic fabric displays.,cc19 c3 fabric display,73
10999,2019+AC0-01+AC0-04 20:23:37.131,sports banners that can change and update according to the teams success.,cc19 c3 fabric display,73
10667,2018+AC0-12+AC0-19 14:15:00.053,. it can be used to detect fingerprints of those who touched the fabric.  ,cc19 c3 fabric display,74
10681,2018+AC0-12+AC0-19 14:20:43.537,+ACI-It can also be attached behind airplane seats, so people can watch videos.+ACI-,cc19 c3 fabric display,74
10782,2018+AC0-12+AC0-19 17:17:17.586,advertising companies who can hand out free apparel and advertise on them,cc19 c3 fabric display,74
10844,2018+AC0-12+AC0-19 18:54:08.28,A fabric display on your pant leg to use for texting and social media use.,cc19 c3 fabric display,74
10784,2018+AC0-12+AC0-19 17:18:09.697,clothing stores can become more vibrant with the clothing they are selling ,cc19 c3 fabric display,75
10900,2019+AC0-01+AC0-03 13:27:49.83,+ACI-This could be used in identifying sick or wounded people, or lost children.+ACI-,cc19 c3 fabric display,76
10862,2019+AC0-01+AC0-03 13:15:19.936,I guess you could make novelty tshirts which could display different images.,cc19 c3 fabric display,76
10872,2019+AC0-01+AC0-03 13:18:56.698,The fashion industry could utilize this to make unique and amazing designs. ,cc19 c3 fabric display,76
10661,2018+AC0-12+AC0-19 14:09:55.824,+ACI-The edge of a tape to change color, so you can easily know where the edge is.+ACI-,cc19 c3 fabric display,77
10665,2018+AC0-12+AC0-19 14:14:46.139,It can be used in a place of a phone to watch videos and browse social media.,cc19 c3 fabric display,77
10765,2018+AC0-12+AC0-19 16:55:28.264,you can use the fabric to camouflage something you do not want people to see,cc19 c3 fabric display,77
10795,2018+AC0-12+AC0-19 17:22:37.562,Digital art canvas that can simulate any kind of brushstroke and paint color.,cc19 c3 fabric display,77
10923,2019+AC0-01+AC0-03 14:36:42.964,It could be used to issue an alert about weather or possible incoming danger,cc19 c3 fabric display,77
10926,2019+AC0-01+AC0-03 14:40:13.151,Controlling your phone or home controls might be possible with touch control.,cc19 c3 fabric display,77
10936,2019+AC0-01+AC0-03 14:48:17.604,+ACI-Fashion purposes, maybe you could even change the color of your whole outfit. +ACI-,cc19 c3 fabric display,78
10974,2019+AC0-01+AC0-03 15:31:20.936,Put it on a workers hat to list company and scrolling info about the company.,cc19 c3 fabric display,78
10668,2018+AC0-12+AC0-19 14:15:10.77,It could be used for putting together fabric to create a new piece of clothing.,cc19 c3 fabric display,79
10669,2018+AC0-12+AC0-19 14:15:22.407,A T+AC0-shirt that displays political messages to show your support for a candidate,cc19 c3 fabric display,79
10922,2019+AC0-01+AC0-03 14:35:40.65,You could be paid by a company to display their Logo or Name for sports events.,cc19 c3 fabric display,79
10906,2019+AC0-01+AC0-03 13:30:08.642,This could be used to scare or otherwise deter wildlife during such encounters.,cc19 c3 fabric display,80
10971,2019+AC0-01+AC0-03 15:28:11.941,An eatery could use for wait staff to list soups of the day and daily specials.,cc19 c3 fabric display,80
11040,2019+AC0-01+AC0-04 22:51:31.767,Touch screen fabric could be used as a replacement for wall mounted televisions.,cc19 c3 fabric display,80
10783,2018+AC0-12+AC0-19 17:17:21.951,Camping tent that can display a perfect camouflage pattern for any environment.  ,cc19 c3 fabric display,81
10903,2019+AC0-01+AC0-03 13:29:16.871,This could be used to identify key team members or targets in military training.,cc19 c3 fabric display,81
11052,2019+AC0-01+AC0-04 23:29:28.735,Projection cloths for schools to save on room and the cost of special equipment.,cc19 c3 fabric display,81
10786,2018+AC0-12+AC0-19 17:18:30.027,stores can easily mark the price of the item directly on that article of clothing,cc19 c3 fabric display,82
10847,2018+AC0-12+AC0-19 18:58:16.723,A fabric display on your clothing for the holidays that flashes Christmas lights. ,cc19 c3 fabric display,82
10941,2019+AC0-01+AC0-03 14:50:32.631,This could be used on curtains or sheets to make a bigger screen for movie viewing,cc19 c3 fabric display,82
10882,2019+AC0-01+AC0-03 13:21:33.725,In a educational setting this could be used as a tactile helper for autistic kids.,cc19 c3 fabric display,82
10676,2018+AC0-12+AC0-19 14:16:41.255,A shirt that acts as a projector screen on which you could display video or movies,cc19 c3 fabric display,83
10752,2018+AC0-12+AC0-19 16:48:57.809,you can have interactive maps for classrooms to learn about countries and geography,cc19 c3 fabric display,83
10777,2018+AC0-12+AC0-19 17:12:21.556,Strip of fabric that can be worn like a watch and perform any smart watch function.,cc19 c3 fabric display,83
10797,2018+AC0-12+AC0-19 17:24:46.079,A hat that switches between the colors and logos of all your favorite sports teams.,cc19 c3 fabric display,83
10950,2019+AC0-01+AC0-03 14:54:03.976,Thinner or more flexible phones and tablets could be made with the fabric display. ,cc19 c3 fabric display,83
10949,2019+AC0-01+AC0-03 14:53:37.674,this could be used to turn your shower curtain into a video player while showering.,cc19 c3 fabric display,83
11058,2019+AC0-01+AC0-04 23:36:24.909,Use the fabrics as giant billboards that hang on flag poles In very popular places.,cc19 c3 fabric display,83
10898,2019+AC0-01+AC0-03 13:27:06.916,This could be used for signalling sports teams' change of position after half time.,cc19 c3 fabric display,84
11060,2019+AC0-01+AC0-04 23:42:23.928,A blanket that has a built in universal remote so lazy people do not have to get up.,cc19 c3 fabric display,84
10833,2018+AC0-12+AC0-19 18:20:53.216,+ACI-write students' names so teachers, expecially substitute teachers, can tell them apart+ACI-,cc19 c3 fabric display,86
10943,2019+AC0-01+AC0-03 14:51:11.635,You could make tents out of the fabric and use it for entertainment purposes at camp.,cc19 c3 fabric display,86
11039,2019+AC0-01+AC0-04 22:50:09.155,A touch screen fabric could be as a wall covering to change imagery presented quickly.,cc19 c3 fabric display,86
10759,2018+AC0-12+AC0-19 16:51:43.286,you can have a cheap movie player to put in cars that is not easily broken by children,cc19 c3 fabric display,87
10849,2018+AC0-12+AC0-19 19:01:13.551,A fabric display on your comforter so that you could watch movies while snuggling up. ,cc19 c3 fabric display,87
10920,2019+AC0-01+AC0-03 14:33:32.596,+ACI-Being able to utilize this technology to change the colors of coats, pants, and shirts.+ACI-,cc19 c3 fabric display,87
10865,2019+AC0-01+AC0-03 13:16:08.301,A flag at the white house that could change based on the dignitaries who are visiting. ,cc19 c3 fabric display,87
10866,2019+AC0-01+AC0-03 13:16:44.43,You could actually use any piece of fabric as a phone to text if it is touch sensitive.,cc19 c3 fabric display,87
11003,2019+AC0-01+AC0-04 21:09:48.536,Thermal window coverings that could simulate the view of any outside scene/environment.,cc19 c3 fabric display,87
11053,2019+AC0-01+AC0-04 23:29:58.191,Special suits that camoflage army units when they are in different locations fighting.,cc19 c3 fabric display,87
10680,2018+AC0-12+AC0-19 14:20:00.201,+ACI-It can be attached to back seats of cars, so people sitting in the back can watch videos.+ACI-,cc19 c3 fabric display,89
10738,2018+AC0-12+AC0-19 15:31:23.238,Fabric could be used on the walls of museums to display the work of famous photographers.,cc19 c3 fabric display,89
10991,2019+AC0-01+AC0-04 20:13:09.699,+ACI-New phone, very small in size with this fabric display that can be folded in your pocket.+ACI-,cc19 c3 fabric display,89
10706,2018+AC0-12+AC0-19 14:34:07.42,A fabric display shirt that also has built in speakers so that videos can play with audio,cc19 c3 fabric display,90
10843,2018+AC0-12+AC0-19 18:52:42.11,A screen for watching videos on toddler's backpacks to help with long car rides or trips. ,cc19 c3 fabric display,90
10868,2019+AC0-01+AC0-03 13:17:39.576,In stadiums the back of every seat could have an interactive replay screen in the fabric. ,cc19 c3 fabric display,90
10885,2019+AC0-01+AC0-03 13:22:48.656,+ACI-With it replacing books, librarys could reduce size or even be eliminated and put online. +ACI-,cc19 c3 fabric display,90
10959,2019+AC0-01+AC0-03 15:00:20.204,You could use this as a punishment for criminals by posting their crimes on their clothing.,cc19 c3 fabric display,91
10855,2019+AC0-01+AC0-03 13:13:18.812,+ACI-You can use this to attach to glasses to see videos, possibly in one eye and not the other.+ACI-,cc19 c3 fabric display,92
10881,2019+AC0-01+AC0-03 13:21:06.518,This could be used as a foreign language aid which shows the name of items as it sees them.,cc19 c3 fabric display,92
10988,2019+AC0-01+AC0-04 20:07:22.801,It could be put on a baby blanket and change images to make babies tummy time more enjoyable.,cc19 c3 fabric display,93
11000,2019+AC0-01+AC0-04 20:25:50.893,some kind of wireless connectivity so there wouldnt have to be a wired penny sized connector.,cc19 c3 fabric display,93
10897,2019+AC0-01+AC0-03 13:26:53.255,All banners now could be programmed to say whatever is wanted and be put away for future use.,cc19 c3 fabric display,93
11010,2019+AC0-01+AC0-04 21:17:37.732,+ACI-This, along with small cameras, could be used to create a sort of adaptive camouflage system.+ACI-,cc19 c3 fabric display,93
11046,2019+AC0-01+AC0-04 22:58:35.482,Touch screen fabric could be used to make clothing for pets that changed on demand by owners.,cc19 c3 fabric display,93
10965,2019+AC0-01+AC0-03 15:04:16.007,You could use this to project onto pillows the pictures of loved ones for babies to be calmer.,cc19 c3 fabric display,94
11043,2019+AC0-01+AC0-04 22:55:00.736,Touch screen fabric could be used for furniture fabric to quickly change the way a room looks.,cc19 c3 fabric display,94
10832,2018+AC0-12+AC0-19 18:20:11.825,Make capes for people at hairdresser so they can amuse themselves during a long boring process,cc19 c3 fabric display,95
10918,2019+AC0-01+AC0-03 14:14:48.136,Streaming calorie counters from small screens on the tops of sneakers as someone is exercising.,cc19 c3 fabric display,95
10939,2019+AC0-01+AC0-03 14:49:44.962,Stuffed animals could be made with this and have pre programmed videos or games for kids on them,cc19 c3 fabric display,96
10977,2019+AC0-01+AC0-03 15:35:07.725,Dance competition teams could use it as part of their costumes to add more to their performance.,cc19 c3 fabric display,96
10899,2019+AC0-01+AC0-03 13:27:25.924,This could be used to highlight players of importance during particular moments in sports games.,cc19 c3 fabric display,97
10946,2019+AC0-01+AC0-03 14:52:48.846,This could be used on rugs to make a rug into a play rug with games or maps to drive toy cars on.,cc19 c3 fabric display,97
